,documento,data_emissao,emitente,cpf_cnpj,valor
0,NOTA FISCAL ELETRONICA 1994,2017-01-27,POSTO UNIVERSO LTDA,10513796000130,783.39
1,RECIBO DE PAGAMENTO DE AUTONOMO 04,2017-01-31,ANDRÉ ROCHA COUTO,21274803000104,2800.0
2,NOTA FISCAL ELETRONICA AVULSA 11183606,2017-01-09,VALTER GRAVINA ROCHA,21274803000104,31.2
3,NOTA FISCAL ELETRONICA 3348,2017-01-17,GISON L LACERDA RIBEIRO - PAPELARIA GIROPEL,03880787000111,39.0
4,NOTA FISCAL ELETRONICA 3348,2017-01-17,GILSON L LACERDA RIBEIRO - PAPELARIA GIROPEL,03880787000111,508.3
