,documento,data_emissao,emitente,cpf_cnpj,categoria,valor
0,danfe 000014339,2017-01-06,solar comunicaçao,21561725000129,"Assinatura de jornais, revistas e periódicos",213.6
1,danfe 000000716,2017-01-27,posto centro choferes ltda,21575972000184,* Combustíveis e lubrificantes de veículos utilizados no exercício do mandato legislativo (¹),605.78
2,cupom fiscal ccf 074700,2017-01-26,thomacelli comercio de alimentos ltda,11192368000115,Copa Interna,72.6
3,danfe 000002108,2017-01-26,sl pack embalagens ltda,11827845000171,Copa Interna,344.0
4,nota fiscal de serviço eletronica 2107/7,2017-01-06,ricardo texeira de aguiar,66464488000116,Estacionamento (uma vaga),260.0
5,nfes 00001200,2017-01-09,vizion gestão de negocios empresariais ltda epp,07979987000187,Locação de softwares,1086.0
6,recibo 3577822,2017-01-02,movida locação de veiculos s.a,07976147020609,Locação de veículos utilizados no exercício do mandato legislativo,2118.0
7,danfe 0000003293,2017-01-27,getline prod. de info ltda,03785499000188,Suprimentos para equipamentos de informática,39.0
8,,,,,total,4738.98
