,Documento,Data Emissão,Emitente,CPF/CNPJ,Valor
0,NOTA FISCAL ELETRONICA 1994,27/01/2017,POSTO UNIVERSO LTDA,10513796000130,"783,39"
1,RECIBO DE PAGAMENTO DE AUTONOMO 04,31/01/2017,ANDRÉ ROCHA COUTO,21274803000104,"2.800,00"
2,NOTA FISCAL ELETRONICA AVULSA 11183606,09/01/2017,VALTER GRAVINA ROCHA,21274803000104,"31,20"
3,NOTA FISCAL ELETRONICA 3348,17/01/2017,GISON L LACERDA RIBEIRO - PAPELARIA GIROPEL,03880787000111,"39,00"
4,NOTA FISCAL ELETRONICA 3348,17/01/2017,GILSON L LACERDA RIBEIRO - PAPELARIA GIROPEL,03880787000111,"508,30"
