,Documento,Data Emissão,Emitente,CPF/CNPJ,Valor
0,DANFE 00001416-FL1/1 SÉRIE 1,30/01/2017,AUTO POSTO VALENTINA LTDA,17817687000155,"750,01"
1,RPA 01/2017,30/01/2017,RONALDO PASSOS JÚNIOR,05030909648,"1.900,00"
2,000.000.482 SÉRIE 1 FL.1 DANFE,30/01/2017,A. CARBONARO AGUA MINERAL,24488698000102,"71,00"
3,NOTA FISCAL DE SERVIÇOS ELETRÔNICA 2017/27,26/01/2017,ESTACIONAMENTO 726 LTDA,00610547000109,"220,00"
4,NOTA FISCAL DE SERVIÇOS ELETRÔNICA 2017/3,30/01/2017,AVENIDA BRASIL RENT A CAR LTDA,16700057000133,"2.190,00"
5,DANFE 648 SÉRIE 1,09/01/2017,TEIXEIRA E CHAVES LTDA - FILIAL 21,21339965001902,"47,00"
6,NOTA FISCAL DE SERVIÇO DE TELECOMUNICAÇÃO 0152084190,25/01/2017,VIVO S/A,02558157000162,"495,99"
