,documento,data_emissao,emitente,cpf_cnpj,valor
0,NOTA FISCAL ELETRÔNICA 000014601,2017-01-31,SOLAR COMUNICACOES SA,21561725000129,258.23
1,NOTA FISCAL ELETRÔNICA 000003002,2017-01-31,POSTO SALGADO LTDA,19030519000140,1417.38
2,RECIBO DE PAGAMENTO A AUTÔNOMO - RPA 01,2017-01-30,FRANCISCO QUIRINO MACHADO,24732710620,1900.0
3,RECIBO DE PAGAMENTO A AUTÔNOMO - RPA 001,2017-01-30,VANESSA TEIXEIRA FERRUGINI,06670120605,1800.0
4,NOTA FISCAL ELETRÔNICA 000001786,2017-01-31,DISTRIBUIDORA DE PAPEIS ANAPEL LTDA,25349796000113,275.0
5,FATURA DE LOCAÇÃO 0397,2017-01-26,CAED COMERCIAL LTDA ME,10717869000105,160.0
6,NOTA FISCAL DE SERVIÇOS ELETRÔNICA 2017/2,2017-01-25,GUSTAVO GOMES PEREIRA,22277191000176,110.0
7,NOTA FISCAL ELETRÔNICA 000001786,2017-01-31,DISTRIBUIDORA DE PAPEIS ANAPEL LTDA,25349796000113,1525.2
