,documento,data_emissao,emitente,cpf_cnpj,valor
0,DANFE 00002136-FL1/1,2018-10-26,AUTO POSTO VALENTINA LTDA,17817687000155,1101.51
1,DANFE 000.001.513 SÉRIE 1,2018-10-23,A. CARBONARO ÁGUA MINERAL,24488698000102,78.0
2,NFS-e 201800000000649,2018-10-26,ESTACIONAMENTO 726 LTDA,00610547000109,220.0
3,NFS-e 201800000000179,2018-10-26,AVENIDA BRASIL RENT A CAR LTDA,16700057000133,2190.0
4,NOTA FISCAL DE SERVIÇO DE TELECOMUNICAÇÃO 0152084190,2018-10-17,VIVO S/A,02558157000162,592.98
5,NOTA FISCAL DE SERVIÇO DE TELECOMUNICAÇÃO 1700424703821,2018-10-29,OI FIXO,33000118000179,226.85
