,Documento,Data Emissão,Emitente,CPF/CNPJ,Valor
0,DANFE 14630,30/10/2018,Posto Romualdo LTDA,66343930000156,"276,39"
1,Nota Fiscal  Eletrônica de Serviços-NFS-e 201800000000116,29/10/2018,"Alvim Soares,Junqueira E Advogados Associados",03853408000102,"1.500,00"
2,DANFE 5346,29/10/2018,Ribeiro de Oliveira & CIA LTDA,21562897000117,"147,30"
3,Nota Fiscal Eletrônica de  Serviços -NFS-e 201800000001441,30/10/2018,Real Copias de juiz de fora,04316977000173,"553,20"
4,Noata Fiscal de Serviços Eletrônica 201800000001422,30/10/2018,União Artes Graficas LTDA,20741559000180,"1.050,00"
5,Fatura de Locação FL 21716,31/10/2018,Themauto Veiculos LTDA,01957100000173,"1.000,00"
6,DANFE 5346,29/10/2018,Ribeiro de Oliveira & CIA LTDA,21562897000117,"601,20"
7,Nota Fiscal de Telecomunicaçôes 1700424703821,31/10/2018,OI FIXO,33000118000179,"176,73"
