,documento,data_emissao,emitente,cpf_cnpj,valor
0,DANFE 00001540-FL1/1 SÉRIE 1,2017-04-27,AUTO POSTO VALENTINA LTDA,17817687000155,659.07
1,RPA 04/0217,2017-04-25,RONALDO PASSOS JÚNIOR,05030909648,1900.0
2,DANFE 000000626 SÉRIE 1,2017-04-25,A. CARBONARO AGUA MINERAL ME,24488698000102,72.0
3,NOTA FISCAL ELETRÔNICA DE SERVIÇO 201700000000118,2017-04-26,ESTACIONAMENTO 726 LTDA,00610547000109,220.0
4,NOTA FISCAL ELETRÔNICA DE SERVIÇO 201700000000021,2017-04-27,AVENIDA BRASIL RENT A CAR LTDA,16700057000133,2190.0
5,DANFE 135512 SÉRIE 1,2017-04-27,PARCO PAPELARIA LTDA,05214053001109,170.0
6,DANFE 135512,2017-04-27,PARCO PAPELARIA LTDA,05214053001109,49.68
7,NOTA FISCAL DE SERVIÇO DE TELECOMUNICAÇÃO 0152084190,2017-04-27,VIVO S/A,02558157000162,495.99
8,NOTA FISCAL DE SERVIÇO DE TELECOMUNICAÇÃO 1700402510631,2017-04-27,OI FIXO,33000118000179,52.57
