,documento,data_emissao,emitente,cpf_cnpj,valor
0,DANFE 00001950-FL1/1 SÉRIE 1,2018-04-26,AUTO POSTO VALENTINA LTDA,17817687000155,1100.51
1,DANFE 000.001.205 SÉRIE 1,2018-04-26,A. CARBONARO ÁGUA MINERAL ME,24488698000102,78.0
2,NFS-e 201800000000468,2018-04-26,ESTACIONAMENTO 726 LTDA,00610547000109,220.0
3,NFS-e 201800000000124,2018-04-26,AVENIDA BRASIL RENT A CAR LTDA,16700057000133,2190.0
4,NOTA FISCAL DE SERVIÇO DE TELECOMUNICAÇÃO 0152084190,2018-04-17,VIVO S/A,02558157000910,589.99
5,NOTA FISCAL DE SERVIÇO DE TELECOMUNICAÇÃO 1700418019588,2018-04-26,OI FIXO,33000118000179,146.77
