,documento,data_emissao,emitente,cpf_cnpj,categoria,valor
0,NOTA FISCAL ELETRÔNICA - (DANFE). 000014484,2018-09-27,POSTO ROMUALDO LTDA.,66343930000156,* Combustíveis e lubrificantes de veículos utilizados no exercício do mandato legislativo (¹),493.48
1,CUPOM FISCAL/BR 478255,2018-09-26,DESCARTAVEIS SANTA RITA LTDA - EPP.,17559832000145,Copa Interna,50.5
2,RECIBO DE ALUGUEL. 006809/016809,2018-09-12,ALMAR IMÓVEIS.,26143271000190,Estacionamento (uma vaga),362.0
3,CUPOM FISCAL/BR 168314,2018-09-04,RIBEIRO DE OLIVEIRA CIA LTDA - EPP.,21562897000117,Material de expediente,31.4
4,COMPROVANTE DO CLIENTE. 1532843450,2018-09-26,ECT-EMP. BRAS. DE CORREIOS E TELEGRAFOS.,42933416000102,Postagem,11.8
5,NOTA FISCAL DE SERVIÇOS DE TELECOMUNICAÇÕES. 8358098/09/2018,2018-09-15,TELEFONICA BRASIL S.A. (VIVO).,02558157000910,Telefone Móvel,296.97
6,NOTA FISCAL DE SERVIÇOS DE TELECOMUNICAÇÕES. 1700423613986,2018-09-28,TELEMAR NORTE E LESTE S/A. (OI).,33000118000179,* Telefone(s) em nome da Câmara(local e interurbano) (³),66.94
7,NOTA FISCAL DE SERVIÇOS DE TELECOMUNICAÇÕES. 1700423613986,2018-09-28,TELEMAR NORTE E LESTE S/A. (OI).,33000118000179,* Telefone(s) em nome da Câmara(local e interurbano) (³),74.69
8,,,,,total,1246.15
