,Documento,Data Emissão,Emitente,CPF/CNPJ,Valor
0,RECIBO DE ALUGUEL 09,15/09/2018,SOUZA LIMA ADMINISTRAÇÃO DE IMOVEIS LTDA,18343665000163,"650,00"
1,NOTA FISCAL CONTA DE ENERGIA ELETRICA 055974577,11/09/2018,CEMIG DISTRIBUIÇÃO S/A,06981180000116,"49,87"
2,RECIBO DE IPTU 8,15/09/2018,PREFEITURA DE JUIZ DE FORA,18343665000163,"151,01"
3,NFS-e 2018/126,03/09/2018,T O RIBEIRO ME,11186215000165,"220,00"
4,NOTA FISCAL SERIE D 002953,27/09/2018,RAFAELLY PAPELARIA LTDA,00778203000103,"270,50"
5,NFS-e 201800000000177,25/09/2018,ALOIZIO COSTA FERREIRA,02017219000129,"40,00"
6,NOTA FISCAL DE SERVIÇOS DE TELECOMUNICAÇÕES 0299408599,04/09/2018,TELEFONICA DO BRASI S/A,02558157000162,"389,99"
7,NOTA FISCAL DE SERVIÇOS DE TELECOMUNICAÇÕES 10211618,04/09/2018,OI,05423963000111,"98,98"
8,NOTA FISCAL DE SERVIÇOS DE TELECOMUNICAÇÕES 1700423613986,26/09/2018,OI FIXO,33000118000179,"305,72"
