,Documento,Data Emissão,Emitente,CPF/CNPJ,Valor
0,DANFE 00002096-FL1/1 SÉRIE 1,25/09/2018,AUTO POSTO VALENTINA LTDA,17817687000155,"1.065,39"
1,DANFE 000.001.455 SÉRIE 1,25/09/2018,A. CARBONARO ÁGUA MINERAL,24488698000102,"52,00"
2,NFS-e 201800000000619,25/09/2018,ESTACIONAMENTO 726 LTDA,00610547000109,"220,00"
3,NFS-e 201800000000172,25/09/2018,AVENIDA BRASIL RENT A CAR LTDA,16700057000133,"2.190,00"
4,NOTA FISCAL DE SERVIÇO DE TELECOMUNICAÇÃO 0152084190,19/09/2018,VIVO S/A,02558157000162,"589,99"
5,NOTA FISCAL DE SERVIÇO DE TELECOMUNICAÇÃO 1700423613986,26/09/2018,OI FIXO,33000118000179,"202,03"
