,documento,data_emissao,emitente,cpf_cnpj,valor
0,CUPOM FISCAL 028385,2017-02-07,SEMPRE COMERCIO DE COMBUSTIVEL LTDA,08111871000780,180.0
1,CUPOM FISCAL 029154,2017-02-09,SEMPRE COMERCIO DE COMBUSTIVEL LTDA,08111871000780,185.79
2,CUPOM FISCAL 733509,2017-02-15,POSTO PENA BRANCA LTDA,18977918000150,160.05
3,CUPOM FISCAL 249588,2017-02-21,POSTO FACIT LTDA,22169455000178,193.0
4,RPA 002,2017-02-24,RICARDO GONÇALVES FRANCISCO,01280080671,2000.0
5,DANFE 000000529,2017-02-22,A CARBONARO AGUA MINERAL ME,24488698000102,161.0
6,DANFE 000010476,2017-02-23,DESCARTAVEIS SANTA RITA LTDA - EPP,17559832000145,10.9
7,DANFE 131017,2017-02-01,PARCO PAPELARIA LTDA,05214053001109,29.8
8,NOTA FISCAL DE SERVIÇO DE TELECOMUNICAÇÕES 00667233,2017-02-24,TELEMAR NORTE LESTE SA,33000118000179,174.35
