,documento,data_emissao,emitente,cpf_cnpj,valor
0,NOTA FISCAL ELETRÔNICA 00003032,2017-02-24,POSTO SALGADO LTDA,19030519000140,1209.33
1,RECIBO DE PAGAMENTO A AUTONOMO - RPA 02,2017-02-21,FRANCISCO QUIRINO MACHADO,24732710620,1900.0
2,RECIBO DE PAGAMENTO A AUTÔNOMO - RPA 002,2017-02-21,VANESSA TEIXEIRA FERRUGINI,06670120605,1800.0
3,NOTA FISCAL DE SERVIÇOS ELETRÔNICA 2017/11,2017-02-22,GRAFICENTER LTDA,86651387000161,1650.0
4,FATURA DE LOCAÇÃO 0402,2017-02-20,CAED COMERCIAL LTDA ME,10717869000105,160.0
5,NOTA FISCAL DE SERVIÇOS ELETRÔNICA 2017/03,2017-02-21,GUSTAVO GOMES PEREIRA,22277191000176,110.0
6,CUPOM FISCAL 000687,2017-02-08,CASA DO IPHONE J F LTDA - EPP,16661921000135,120.0
7,NOTA FISCAL DE SERVIÇOS ELETRÔNICA 2017/29,2017-02-20,CAED COMERCIAL LTDA,10717869000105,50.0
8,FATURA DE SERVIÇOS EM TELECOMUNICAÇÃO 00667233,2017-02-24,OI FIXO,33000118000179,629.02
