,documento,data_emissao,emitente,cpf_cnpj,categoria,valor
0,DANFE 00001457-FL 1/1 SÉRIE 1,2017-02-21,AUTO POSTO VALENTINA LTDA,17817687000155,* Combustíveis e lubrificantes de veículos utilizados no exercício do mandato legislativo (¹),700.43
1,RPA 02/2017,2017-02-21,RONALDO PASSOS JÚNIOR,05030909648,* Consultoria técnica,1900.0
2,DANFE 000.000.524 SÉRIE 1,2017-02-17,A. CARBONARO AGUA MINERAL ME,24488698000102,Copa Interna,72.0
3,NOTA FISCAL DE SERVIÇOS ELETRÔNICA 2017/8,2017-02-21,AVENIDA BRASIL RENT A CAR LTDA,16700057000133,Locação de veículos utilizados no exercício do mandato legislativo,2190.0
4,CUPOM FISCAL 007379,2017-02-14,TEIXEIRA E CHAVES LTDA,21339965001902,Material de expediente,18.75
5,DANFE 1291 SÉRIE 001,2017-02-03,TEIXEIRA E CHAVES LTDA - FILIAL 21,21339965001902,Suprimentos para equipamentos de informática,44.9
6,NOTA FISCAL DE SERVIÇO DE TELECOMUNICAÇÃO 0152084190,2017-02-21,VIVO S/A,02558157000162,Telefone Móvel,495.99
7,NOTA FISCAL DE SERVIÇO DE TELECOMUNICAÇÃO 00667233,2017-02-24,OI FIXO,33000118000179,* Telefone(s) em nome da Câmara(local e interurbano) (³),274.35
8,,,,,total,5422.07
