,Documento,Data Emissão,Emitente,CPF/CNPJ,Valor
0,DANFE - DOCUMENTO AUXILIAR DA NOTA FISCAL ELETRONICA 00004285,10/12/2018,POSTO JOQUEI CLUBE LTDA,41660648000171,"320,00"
1,RPA - RECIBO DE PAGAMENTO AUTONOMO 13,11/12/2018,ELISA CAMPOS FIGUEROA,09981782688,"2.400,00"
2,NOTA FISCAL ELETRONICA DE SERVIÇOS - NFS-E 201800000000141,11/12/2018,ESTACIONAMENTO SALVE JORGE LTDA,17509454000195,"300,00"
3,NOTA FISCAL ELETRONICA 201800000001664,11/12/2018,W.COLLOR EDITORA GRÁFICA LTDA,05033125000131,"460,00"
4,FATURA 000105,11/12/2018,ESTACIONAMENTO SALVE JORGE LTDA,17509454000195,"2.300,00"
