,Documento,Data Emissão,Emitente,CPF/CNPJ,Valor
0,Recibo do Sacado 64181,17/12/2018,Diretrans Ltda,19490812000190,"720,00"
1,Danfe 00004268,18/12/2018,Auto Posto Bandeirantes Ltda,21058508000110,"646,00"
2,Recibo do Pagador 14000000001112740-1,10/12/2018,Cond. Ed. Rossi Rio Branco Corporate,20291262000160,"279,74"
3,Nota Fiscal 077869732,17/12/2018,Cemig Distribuição S.A.,06981180000116,"48,00"
4,Nota Fiscal 201800000001614,03/12/2018,WColor Editora Gráfica Ltda,05033125000131,"550,00"
5,Fatura 000104,11/12/2018,Estacionamento Salve Jorge Ltda,17509454000195,"2.300,00"
