,documento,data_emissao,emitente,cpf_cnpj,categoria,valor
0,NOTA FISCAL ELETRÔNICA 000003390,2018-03-29,POSTO SALGADO LTDA,19030519000140,,1588.11
1,RECIBO DE PAGAMENTO A AUTÔNOMO - RPA 15,2018-03-23,FRANCISCO QUIRINO MACHADO,24732710620,['* Consultoria técnica'],1900.0
2,RECIBO DE PAGAMENTO A AUTÔNOMO - RPA 015,2018-03-26,VANESSA TEIXEIRA FERRUGINI,06670120605,['* Consultoria técnica'],1800.0
3,FATURA DE LOCAÇÃO 0575,2018-03-26,CAED COMERCIAL LTDA ME,10717869000105,['Locação de  equipamentos'],160.0
4,NOTA FISCAL ELETRÔNICA DE SERVIÇOS 201800000000024,2018-03-22,GUSTAVO GOMES PEREIRA,22277191000176,['Locação de softwares'],140.0
5,NOTA FISCAL ELETRÔNICA DE SERVIÇOS 201800000000310,2018-03-26,CAED COMERCIAL LTDA,10717869000105,['Suprimentos para equipamentos de informática'],50.0
6,FATURA 892607720,2018-03-16,OI MÓVEL S.A.,05423963000111,['Telefone Móvel'],75.9
7,FATURA DE SERVIÇOS EM TELECOMUNICAÇÃO 1700416853428,2018-03-26,OI FIXO,33000118000179,['* Telefone(s) em nome da Câmara(local e interurbano) (³)'],155.0
