,documento,data_emissao,emitente,cpf_cnpj,valor
0,danfe 786,2017-11-30,posto choferes ltda,21575972000184,1642.14
1,nfse 201700000000156,2017-11-30,house criaçao,23471850000173,1334.0
2,danfe 3599,2017-11-16,sl pack embalagens ltda,11827845000171,195.0
3,nfse 20170000000061,2017-11-07,ricardo texeira de aguiar,66464488000116,260.0
4,nfse 201700000000399,2017-11-16,w collor editora grafiga ltda,05033125000131,900.0
5,nfse 00001356,2017-11-16,vizion gestao de negocios empresariais ltda epp,07979987000187,586.0
6,recibo s/ numero,2017-11-06,movida locaçao de veiculos s/a,07976147020609,1487.62
7,nota fiscal 1700411982602,2017-11-30,oi fixo,33000118000179,296.72
