,Documento,Data Emissão,Emitente,CPF/CNPJ,Valor
0,NOTA FISCAL ELETRÔNICA 000003205,28/07/2017,POSTO SALGADO LTDA,19030519000140,"1.407,77"
1,RECIBO DE PAGAMENTO A AUTÔNOMO - RPA 07,25/07/2017,FRANCISCO QUIRINO MACHADO,24732710620,"1.900,00"
2,RECIBO DE PAGAMENTO A AUTÔNOMO - RPA 007,28/07/2017,VANESA TEIXEIRA FERRUGINI,06670120605,"1.800,00"
3,NOTA FISCAL DE SERVIÇO ELETRÔNICA 201700000000205,28/07/2017,TIPOGRAFIA TAMOIO LTDA,17145301000106,"1.000,00"
4,FATURA DE LOCAÇÃO 0464,24/07/2017,CAED COMERCIAL LTDA ME,10717869000105,"160,00"
5,NOTA FISCAL ELETRÔNICA DE SERVIÇO 201700000000013,25/07/2017,GUSTAVO GOMES PEREIRA,22277191000176,"110,00"
6,FATURA DE SERVIÇOS EM TELECOMUNICAÇÕES 1700405526945,28/07/2017,OI FIXO,33000118000179,"217,48"
