,documento,data_emissao,emitente,cpf_cnpj,valor
0,DANFE 00001654-FL1/1 SÉRIE 1,2017-07-24,AUTO POSTO VALENTINA LTDA,17817687000155,677.12
1,RPA 07/2017,2017-07-27,RONALDO PASSOS JÚNIOR,05030909648,1900.0
2,DANFE 000.000.759 SÉRIE 1,2017-07-26,A. CARBONARO ÁGUA MINERAL ME,24488698000102,52.0
3,NOTA FISCAL ELETRÔNICA DE SERVIÇO 201700000000204,2017-07-25,ESTACIONAMENTO 726 LTDA,00610547000109,220.0
4,NOTA FISCAL ELETRÔNICA DE SERVIÇO 201700000000041,2017-07-24,AVENIDA BRASIL RENT A CAR LTDA,16700057000133,2190.0
5,NOTA FISCAL DE SERVIÇO DE TELECOMUNICAÇÃO 0152084190,2017-07-17,VIVO S/A,02558157000162,569.99
6,NOTA FISCAL DE SERVIÇO DE TELECOMUNICAÇÃO 1700405526945,2017-07-28,OI FIXO,33000118000179,143.12
