,documento,data_emissao,emitente,cpf_cnpj,valor
0,danfe 765,2017-07-31,posto centro choferes ltda,21575972000184,1141.69
1,rpa 005,2017-07-28,maria tereza lamego genevam,10147971608,1500.0
2,cupom fiscal 076995,2017-07-31,thomacelli com de alimentos ltda,11192368000115,101.5
3,nfse 201700000000040,2017-07-06,ricardo teixeira de aguiar,66464488000116,260.0
4,nfse 1291,2017-07-10,vizion gestao de negocios empresariais ltda epp,07979987000187,586.0
5,recibo 3577822/1,2017-07-05,movida locaçao de veiculos s/a,07976147020609,2118.0
6,nota fiscal de serviços de telecomunicação 1700405526945,2017-07-31,oi fixo,33000118000179,406.21
