,documento,data_emissao,emitente,cpf_cnpj,categoria,valor
0,Nota Fiscal Eletronica 6065,2017-07-25,Posto Paraibuna LTDA,22388292000114,* Combustíveis e lubrificantes de veículos utilizados no exercício do mandato legislativo (¹),235.57
1,Nota Fiscal Eletronica 0090,2017-07-25,Posto Central LTDA,21549407000142,* Combustíveis e lubrificantes de veículos utilizados no exercício do mandato legislativo (¹),292.06
2,Nota Fiscal Eletrônica de Serviços 2101700000000012,2017-07-31,Aristides Ribeiro Advogados Associados S/A,04504649000109,* Consultoria técnica,3000.0
3,Nota Fiscal Eletronica 3427,2017-07-28,Getiline Produtos de Informatica LTDA Jetiline Cartuchos,03785499000188,Material de expediente,83.6
4,Nota Fiscal Eletronica 3666,2017-07-10,Teixeiras e Chaves LTDA,21339965001902,Suprimentos para equipamentos de informática,59.5
5,Nota fiscal de Serviço de Telecomunicação 0304814216,2017-07-20,Vivo,02558157000910,Telefone Móvel,394.63
6,Nota Fiscal de Serviços de Telecomunicação 1700405526945,2017-07-31,OI,33000118000179,* Telefone(s) em nome da Câmara(local e interurbano) (³),199.32
7,,,,,total,4065.36
