,Documento,Data Emissão,Emitente,CPF/CNPJ,Valor
0,DOCUMENTO AUXILIAR DA NOTA FICAL ELETRÔNICA 000018530,15/12/2017,SOLAR COMUNICAÇÕES,21561725000129,"128,75"
1,DOCUMENTO AUXILIAR DA NOTA FISCAL ELETRÔNICA 00003963,15/12/2017,TLP COMÉRCIO DE COMBUSTÍVEIS LTDA,07583737000123,"323,62"
2,DOCUMENTO AUXILIAR DA NOTA FISCAL ELETRÔNICA 4701,18/12/2017,RIBEIRO DE OLIVEIRA & CIA LTDA,21562897000117,"14,70"
3,NOTA FISCAL ELETRÔNICA DE SERVIÇO 201700000000317,14/12/2017,VANUSA NEVES DE OLIVEIRA SALIBA,23807999000180,"140,00"
4,NOTA FISCAL ELETRÔNICA DE SERVIÇOS 201700000000064,18/12/2017,RICARDO TEIXEIRA DE AGUIAR,66464488000116,"260,00"
5,FATURA 000154,12/12/2017,ESTACIONAMENTO SALVE JORGE LTDA- ME,17509454000195,"2.300,00"
6,DOCUMENTO AUXILIAR DA NOTA FISCAL ELETRÔNICA 4701,18/12/2017,RIBEIRO DE OLIVEIRA & CIA LTDA,21562897000117,"110,70"
7,NOTA FISCAL DE SERVIÇOS DE TELECOMUNICAÇÕES 00027678/112017,13/12/2017,CLARO,40432544011262,"365,77"
