,Documento,Data Emissão,Emitente,CPF/CNPJ,Valor
0,DANFE - DOCUMENTO AUXILIAR DA NOTA FISCAL ELETRONICA 00003366,15/12/2017,POSTO JOQUEI CLUBE LTDA,41660648000171,"591,04"
1,RPA - RECIBO DE PAGAMENTO AUTONOMO 25,15/12/2017,ELISA CAMPOS FIGUEROA,09981782688,"2.400,00"
2,NOTA FISCAL ELETRONICA DE SERVIÇO 201700000000071,12/12/2017,ESTACIONAMENTO SALVE JORGE LTDA - ME,17509454000195,"300,00"
3,FATURA 000153,12/12/2017,ESTACIONAMENTO SALVE JORGE LTDA - ME,17509454000195,"2.300,00"
4,COMPROVANTE DO CLIENTE 1403147259,15/12/2017,ECT - EMPRESA BRASILEIRA DE CORREIOS E TELEGRAFOS,34028316553110,"156,25"
