,Documento,Data Emissão,Emitente,CPF/CNPJ,Valor
0,DANFE 00001978-FL1/1 SÉRIE 1,25/05/2018,AUTO POSTO VALENTINA LTDA,17817687000155,"1.100,21"
1,DANFE 000.001.252 SÉRIE 1,24/05/2018,A. CARBONARO AGUA MINERAL ME,24488698000102,"78,00"
2,NFS-e 201800000000496,28/05/2018,ESTACIONAMENTO 726 LTDA,00610547000109,"220,00"
3,NFS-e 201800000000135,25/05/2018,AVENIDA BRASIL RENT A CAR LTDA,16700057000133,"2.190,00"
4,NOTA FISCAL DE SERVIÇO DE TELECOMUNICAÇÃO 0152084190,17/05/2018,VIVO S/A,02558157000162,"589,99"
5,NOTA FISCAL DE SERVIÇO DE TELECOMUNICAÇÃO 1700419157952,23/05/2018,OI FIXO,33000118000179,"151,61"
