,Documento,Data Emissão,Emitente,CPF/CNPJ,Valor
0,Nota Fiscal Eletrônica 00002247,29/01/2019,Auto Posto Valentina Ltda,17817687000155,"816,55"
1,Recibo Pagamento Autônomo 001,30/01/2019,Paulo Ssérgio Gomes Aroni,52148270672,"3.400,00"
2,Recibo 7020894,31/01/2019,Movida Aluguel de Carros,07976147020609,"1.380,78"
3,Nota Fiscal Eletrônica 000003936,16/01/2019,Perfect Paper Informática Ltda,19857923000192,"40,80"
4,Perfect Paper Informática Ltda- ME 000003936,16/01/2019,Perfect Paper Infirmática ltda,19857923000192,"65,00"
5,Nota fiscal de Serviços Eletrônica 1700426832955,30/01/2019,OI FIXO,33000118000179,"66,03"
6,Nota fiscal de Serviços Eletrônica 1700427876863,30/01/2019,OI FIXO,33000118000179,"66,05"
