,documento,data_emissao,emitente,cpf_cnpj,valor
0,DANFE 00002032 - FL 1/1 SÉRIE 1,2018-07-25,AUTO POSTO VALENTINA LTDA,17817687000155,1138.34
1,DANFE 000.001.339 SÉRIE 1,2018-07-24,A. CARBONARO AGUA MINERAL,24488698000102,26.0
2,NFS-e 201800000000555,2018-07-25,ESTACIONAMENTO 726 LTDA,00610547000109,220.0
3,NFS-e 201800000000176,2018-07-25,ANTONIO CARLOS WEISS,16709792000108,120.0
4,NFS-e 201800000000149,2018-07-25,AVENIDA BRASIL RENT A CAR LTDA,16700057000133,2190.0
5,DANFE 6083 SÉRIE 1,2018-07-24,TEIXEIRA E CHAVES LTDA - FILIAL 22,21339965001821,34.5
6,NOTA FISCAL DE SERVIÇO DE TELECOMUNICAÇÃO 0152084190,2018-07-16,VIVO S/A,02558157000162,589.99
7,NOTA FISCAL DE SERVIÇO DE TELECOMUNICAÇÃO 1700421406453,2018-07-25,OI FIXO,33000118000179,245.56
