,documento,data_emissao,emitente,cpf_cnpj,valor
0,DANFE 00001890-FL1/1 SÉRIE 1,2018-02-26,AUTO POSTO VALENTINA LTDA,17817687000155,934.48
1,DANFE 000.001.109 SÉRIE 1,2018-02-22,A. CARBONARO AGUA MINERAL ME,24488698000102,78.0
2,NFS-e 201800000000411,2018-02-26,ESTACIONAMENTO 726 LTDA,00610547000109,220.0
3,NFS-e 201800000000103,2018-02-26,AVENIDA BRASIL RENT A CAR LTDA,16700057000133,2190.0
4,DANFE 4512 SÉRIE 1,2018-02-01,TEIXEIRA E CHAVES LTDA - FILIAL 22,21339965001821,29.9
5,NOTA FISCAL DE SERVIÇO DE TELECOMUNICAÇÃO 0152084190,2018-02-16,VIVO S/A,02558157000162,611.2
6,NOTA FISCAL DE SERVIÇO DE TELECOMUNICAÇÃO 1700415674971,2018-02-26,OI FIXO,33000118000179,200.12
