,documento,data_emissao,emitente,cpf_cnpj,valor
0,DANFE 00001499-FL 1/1 SÉRIE 1,2017-03-27,AUTO POSTO VALENTINA LTDA,17817687000155,685.31
1,RPA 03/2017,2017-03-29,RONALDO PASSOS JÚNIOR,05030909648,1900.0
2,DANFE 000.000.579 SÉRIE 1,2017-03-28,A. CARBONARO ÁGUA MINERAL ME,24488698000102,48.0
3,NOTA FISCAL DE SERVIÇOS ELETRÔNICA 2017/90,2017-03-28,ESTACIONAMENTO 726 LTDA,00610547000109,220.0
4,NOTA FISCAL DE SERVIÇOS ELETRÔNICA 2017/11,2017-03-27,AVENIDA BRASIL RENT A CAR LTDA,16700057000133,2190.0
5,NOTA FISCAL DE SERVIÇO DE TELECOMUNICAÇÃO 0152084190,2017-03-22,VIVO S/A,02558157000162,495.99
6,NOTA FISCAL DE SERVIÇO DE TELECOMUNICAÇÃO 1700401096287,2017-03-28,OI FIXO,33000118000179,284.35
