,documento,data_emissao,emitente,cpf_cnpj,valor
0,NOTA FISCAL ELETRÔNICA 000003070,2017-03-30,POSTO SALGADO LTDA,19030519000140,1331.3
1,RECIBO DE PAGAMENTO A AUTÔNOMO - RPA 03,2017-03-24,FRANCISCO QUIRINO MACHADO,24732710620,1900.0
2,RECIBO DE PAGAMENTO A AUTÔNOMO - RPA 003,2017-03-27,VANESSA TEIXEIRA FERRUGINI,06670120605,1800.0
3,NOTA FISCAL DE SERVIÇOS ELETRÔNICA 2017/13,2017-03-30,GRAFICENTER LTDA,86651387000161,1000.0
4,NOTA FISCAL ELETRÔNICA 013779,2017-03-31,RECAUCHUBRAS PNEUS LTDA,17078163000270,748.0
5,FATURA DE LOCAÇÃO 0413,2017-03-28,CAED COMERCIAL LTDA ME,10717869000105,160.0
6,NOTA FISCAL DE SERVIÇOS ELETRÔNICA 2017/5,2017-03-28,GUSTAVO GOMES PEREIRA,22277191000176,110.0
7,FATURA DE SERVIÇOS EM TELECOMUNICAÇÃO 1700401096287,2017-03-28,OI FIXO,33000118000179,249.68
