,documento,data_emissao,emitente,cpf_cnpj,valor
0,NOTA FISCAL ELETRONICA 2144,2017-05-31,POSTO UNIVERSO LTDA,10513796000130,1125.81
1,RECIBO DE PAGAMENTO DE AUTONOMO 008,2017-05-26,André Rocha Couto,06115958695,2800.0
2,NOTA FISCAL AVULSA ELETRONICA 12031525,2017-05-25,VALTER GRAVINA ROCHA,21274803000104,15.6
3,NOTA FISCAL ELETRONICA DE SERVIÇO 20170000000124,2017-05-30,SHOPPING DOS CARIMBOS LTDA,19790949000160,1800.0
4,RECIBO DE SERVIÇO 230,2017-05-30,PARK LOC SERVIÇOS LTDA,17002176000185,1500.0
5,DEMONSTRATIVO DE SERIVÇOS PRESTADOS 020,2017-05-30,COMERCIAL MCP LTDA - AGF SÃO SEBASTIAO,42878561000138,188.25
6,FATURA DE SERVIÇOS DE TELECOMUNICAÇAO 2121231516,2017-05-29,TELEFONICA BRASIL S/A - VIVO,02558157000162,369.99
7,FATURA DE SERVIÇOS DE TELECOMUNICAÇÃO 1700403894827,2017-05-30,OI FIXO,33000118000179,391.42
