,Documento,Data Emissão,Emitente,CPF/CNPJ,Valor
0,NOTA FISCAL ELETRONICA 2144,31/05/2017,POSTO UNIVERSO LTDA,10513796000130,"1.125,81"
1,RECIBO DE PAGAMENTO DE AUTONOMO 008,26/05/2017,André Rocha Couto,06115958695,"2.800,00"
2,NOTA FISCAL AVULSA ELETRONICA 12031525,25/05/2017,VALTER GRAVINA ROCHA,21274803000104,"15,60"
3,NOTA FISCAL ELETRONICA DE SERVIÇO 20170000000124,30/05/2017,SHOPPING DOS CARIMBOS LTDA,19790949000160,"1.800,00"
4,RECIBO DE SERVIÇO 230,30/05/2017,PARK LOC SERVIÇOS LTDA,17002176000185,"1.500,00"
5,DEMONSTRATIVO DE SERIVÇOS PRESTADOS 020,30/05/2017,COMERCIAL MCP LTDA - AGF SÃO SEBASTIAO,42878561000138,"188,25"
6,FATURA DE SERVIÇOS DE TELECOMUNICAÇAO 2121231516,29/05/2017,TELEFONICA BRASIL S/A - VIVO,02558157000162,"369,99"
7,FATURA DE SERVIÇOS DE TELECOMUNICAÇÃO 1700403894827,30/05/2017,OI FIXO,33000118000179,"391,42"
