,documento,data_emissao,emitente,cpf_cnpj,valor
0,DANFE 00002065-FL1/1,2018-08-28,AUTO POSTO VALENTINA LTDA,17817687000155,1043.68
1,DANFE 000.001.392 SÉRIE 1,2018-08-28,A CARBONARO AGUA MINERAL,24488698000102,78.0
2,NFS-e 201800000000590,2018-08-28,ESTACIONAMENTO 726 LTDA,00610547000109,220.0
3,NFS-e 201800000000160,2018-08-28,AVENIDA BRASIL RENT A CAR LTDA,16700057000133,2190.0
4,NOTA FISCAL DE SERVIÇO DE TELECOMUNICAÇÃO 0152084190,2018-08-17,VIVO S/A,02558157000162,589.99
5,NOTA FISCAL DE SERVIÇO DE TELECOMUNICAÇÃO 1700422515815,2018-08-28,OI FIXO,33000118000179,178.88
