,documento,data_emissao,emitente,cpf_cnpj,categoria,valor
0,NOTA FISCAL ELETRONICA 2589,2018-08-30,POSTO UNIVERSO LTDA,10513796000130,* Combustíveis e lubrificantes de veículos utilizados no exercício do mandato legislativo (¹),1340.91
1,NOTA FISCAL DE SERVIÇO 201800001000004,2018-08-31,ROCHA COUTO SOCIEDADE INDIVIDUAL DE ADVOCACIA,30189942000120,* Consultoria técnica,2800.0
2,NOTA FISCAL DE SERVIÇOS ELETRONICA 201800000000043,2018-08-30,ESTACIONALMENTO MARECHAL LTDA,16482521000162,Estacionamento (uma vaga),250.0
3,RECIBO DE SERVIÇO 189,2018-08-30,LOCMAIS LOC CAR SERVIÇOS LTDA,27492985000176,Locação de veículos utilizados no exercício do mandato legislativo,1700.0
4,COMPROVANTE DO CLIENTE 21,2018-08-30,AGF SÃO SEBASTIÃO  - COMERCIAL MCP LTDA,42878561000138,Postagem,180.6
5,NOTA FISCAL DE SERVIÇOS 9004,2018-08-21,TEIXEIRA E CHAVES LTDA,21339965001902,Suprimentos para equipamentos de informática,124.0
6,FATURA DE SERVIÇOS DE TELEFONIA MOVEL 212123516,2018-08-29,TELEFONICA BRASIL S.A,02558157000162,Telefone Móvel,389.99
7,FATURA DE SERVIÇOS DE TELEFONIA FIXA 1700422515815,2018-08-31,OI FIXO,33000118000179,* Telefone(s) em nome da Câmara(local e interurbano) (³),399.34
8,,,,,total,6785.5
