,Documento,Data Emissão,Emitente,CPF/CNPJ,Valor
0,NOTA FISCAL ELETRONICA 2589,30/08/2018,POSTO UNIVERSO LTDA,10513796000130,"1.340,91"
1,NOTA FISCAL DE SERVIÇO 201800001000004,31/08/2018,ROCHA COUTO SOCIEDADE INDIVIDUAL DE ADVOCACIA,30189942000120,"2.800,00"
2,NOTA FISCAL DE SERVIÇOS ELETRONICA 201800000000043,30/08/2018,ESTACIONALMENTO MARECHAL LTDA,16482521000162,"250,00"
3,RECIBO DE SERVIÇO 189,30/08/2018,LOCMAIS LOC CAR SERVIÇOS LTDA,27492985000176,"1.700,00"
4,COMPROVANTE DO CLIENTE 21,30/08/2018,AGF SÃO SEBASTIÃO  - COMERCIAL MCP LTDA,42878561000138,"180,60"
5,NOTA FISCAL DE SERVIÇOS 9004,21/08/2018,TEIXEIRA E CHAVES LTDA,21339965001902,"124,00"
6,FATURA DE SERVIÇOS DE TELEFONIA MOVEL 212123516,29/08/2018,TELEFONICA BRASIL S.A,02558157000162,"389,99"
7,FATURA DE SERVIÇOS DE TELEFONIA FIXA 1700422515815,31/08/2018,OI FIXO,33000118000179,"399,34"
