,documento,data_emissao,emitente,cpf_cnpj,valor
0,NOTA FISCAL ELETRÔNICA 000003290,2017-10-30,POSTO SALGADO LTDA,19030519000140,1349.01
1,RECIBO DE PAGAMENTO A AUTÔNOMO 10,2017-10-26,FRANCISCO QUIRINO MACHADO,24732710620,1900.0
2,RECIBO DE PGAMENTO A AUTÔNOMO- RPA 010,2017-10-26,VANESSA TEIXEIRA FERRUGINI,06670120605,1800.0
3,NOTA FISCAL DE SERVIÇOS ELETRÔNICA 201700000000283,2017-10-30,TIPOGRAFIA TAMOIO LTDA,17145301000106,1575.0
4,FATURA DE LOCAÇÃO 0505,2017-10-24,CAED COMERCIAL LTDA ME,10717869000105,160.0
5,ÑOTA FISCAL ELETRÔNICA DE SERVIÇO 201700000000016,2017-10-24,GUSTAVO GOMES PEREIRA,22277191000176,110.0
6,FATURA DE SERVIÇOS EM TELECOMUNICAÇÃO 821354445,2017-10-30,OI,05423963016387,75.89
7,NOTA FISCAL DE SERVIÇOS EM TELECOMUNICAÇÃO 17004107054125,2017-10-30,OI FIXO,33000118000179,190.14
