,documento,data_emissao,emitente,cpf_cnpj,categoria,valor
0,DANFE 00001764-FL1/1 SÉRIE 1,2017-10-26,AUTO POSTO VALENTINA LTDA,17817687000155,* Combustíveis e lubrificantes de veículos utilizados no exercício do mandato legislativo (¹),627.96
1,RPA 10/2017,2017-10-27,RONALDO PASSOS JÚNIOR,05030909648,* Consultoria técnica,1900.0
2,DANFE 000.000.916 SÉRIE 1,2017-10-25,A. CARBONARO AGUA MINERAL ME,24488698000102,Copa Interna,104.0
3,NOTA FISCAL ELETRÔNICA DE SERVIÇO 201700000000294,2017-10-26,ESTACIONAMENTO 726 LTDA,00610547000109,Estacionamento (uma vaga),220.0
4,NOTA FISCAL ELETRÔNICA DE SERVIÇO 201700000000084,2017-10-23,AVENIDA BRASIL RENT A CAR LTDA,16700057000133,Locação de veículos utilizados no exercício do mandato legislativo,2190.0
5,DANFE 5296 SÉRIE 1,2017-10-18,TEIXEIRA E CHAVES LTDA - FILIAL 21,21339965001902,Suprimentos para equipamentos de informática,32.0
6,NOTA DE FISCAL DE SERVIÇO DE COMUNICAÇÃO 0152084190,2017-10-16,VIVO,02558157000162,Telefone Móvel,569.99
7,NOTA FISCAL DE SERVIÇO DE TELECOMUNICAÇÃO 1700410705412,2017-10-27,OI FIXO,33000118000179,* Telefone(s) em nome da Câmara(local e interurbano) (³),76.82
8,,,,,total,5643.95
